Metareview,Summary
"This paper proposes a class of neural processes that lifts the limitations of conditional neural processes (CNPs) and produces dependent/correlated outputs but that, as CNPs, is inherently scalable and it is easy to train via maximum likelihood. The proposed model is extended to multi-output regression and to capture non-Gaussian output distributions. Results are presented on synthetic data, an electroencephalogram dataset and on a climate modeling problem. The paper parameterizes the prediction map as a Gaussian, where the mean and covariance are determined using neural networks. Non-Gaussian prediction maps are obtained using copulas. 

Technically speaking, the reviewers found the approach to be incremental and only marginally significant and I agree with them. Issues such as estimates of computational cost, using fixed lengthscales for the covariances and relationships/using normalizing flows have been addressed by the authors satisfactorily. Empirically, the contribution of the paper is somewhat significant, as it provides similar flexibility to other more computationally expensive processes and more general assumptions than conditional neural processes.","This paper proposes a class of neural processes that lifts the limitations of conditional neural processes (CNPs) and produces dependent/correlated outputs but that, as CNPs, is inherently scalable and it is easy to train via maximum likelihood. The proposed model is extended to multi-output regression and to capture non-Gaussian output distributions. The paper parameterizes the prediction map as a Gaussian, where the mean and covariance are determined using neural networks."
"Exploration can happen at various levels of granularity and at different times during an episode,  and this work performs a study of the problem of exploration (when to explore/when to switch between exploring and exploitation, at what time-scale to do so, and what signals would be good triggers to switch). The study is performed on atari games.

Strenghts:
------------
The study is well motivated and the manuscript is overall well written
Studies a new problem area, and proposes an initial novel method for this problem
extensive study on atari problems

Weaknesses
--------------
some clarity issues as pointed out by the reviewers
no illustrative task is given to give a more intuitive exposition of the ""when to explore"" problem
comparison to some extra baselines like GoExplore would have been insightful

Rebuttal:
----------
Most clarity issues have been addressed satisfactorily. It has been explained why some requests for extra baselines would be challenging/or not relevant enough. While the authors agree that GoExplore would be an interesting baseline, they seem to have not added it. An illustrative task was not provided.

Summary:
------------
All reviewers agree that this manuscript opens up and tackles a novel direction in exploration, and provides an extensive empirical study on atari games (a standard benchmark for such problem settings). While I agree with the reviewers that point out that this paper could have been made stronger by adding an illustrative task and additional baselines like GoExplore, there is a general consensus that the provided empirical study on this novel problem setting is a good contribution in itself. Because of this I recommend accept.","This paper introduces a novel approach to neural network training, leveraging recent advancements in optimization techniques. Reviewers found the experimental results compelling, demonstrating significant improvements over existing methods. Overall, the paper received a positive recommendation with minor revisions. The reviewers agree that this paper opens up and tackles rebuttal, and provides an extensive empirical study on atari games (a standard benchmark for such problem settings). While the reviewers agreed that the paper could have been made stronger by adding an illustrative task and additional baselines."
"This paper proposes an unsupervised graph learning method [Iterative Graph Self-Distillation (IGSD)] by iteratively performing self-distillation to contrast graph pairs under different augmented views. This idea is then extended to semi-supervised setting where via a supervised contrastive loss and self-training. The method is empirically evaluated on some semi-supervised graph classification and molecular property prediction tasks, and has achieved promising results.

Reviewers agree that the method is interesting and the paper is well-written. The biggest concern from reviewers related to experimental evaluations of the method. The authors responded to this and included additional experiments. Although the reviewers appreciate the provided results and explanations, at the end they were not convinced about the empirical assessments. In particular, R1's post rebuttal comment indicates concerns about the reported performance of GCKN, which is different from the published one in Table 1 of GCKN paper. I encourage authors to improve on these experimental discrepancies and resubmit. ","This paper proposes an unsupervised graph learning method (IGSD) by iteratively performing self-distillation to contrast graph pairs under different augmented views. The method is empirically evaluated on some semi-supervised graph classification and molecular property prediction tasks, and has achieved promising results. Reviewers agree that the method is interesting and the paper is well-written."
"This paper suggests that adversarial vulnerability scales with the dimension of the input of neural networks, and support this hypothesis theoretically and experimentally. 

The work is well-written, and all of the reviewers appreciated the easy-to-read and clear nature of the theoretical results, including the assumptions and limitations. (The AC did not consider the criticisms raised by Reviewer 3 justified. The norm-bound perturbations considered here are a sufficiently interesting unsolved problem in the community and a clear prerequisite to solving the broader network robustness problem.) 

However, many of the reviewers also agreed that the theoretical assumptions - and, in particular, the random initialization of the weights - greatly oversimplify the problem. Reviewers point out that the lack of data dependence and only considering the norm of the gradient considerably limit the significance of the corresponding theoretical results, and also does not properly address the issue of gradient masking. ","The paper proposes a novel approach to neural network training, leveraging recent advancements in optimization techniques. Reviewers found the experimental results compelling, demonstrating significant improvements over existing methods. Overall, the paper received a positive recommendation with minor revisions. The paper is well-written, and all reviewers appreciated the easy-to-read and clear nature of the theoretical results, including the assumptions and limitations. The reviewers also agreed that the lack of data dependence and only considering the norm of the gradient considerably limit the significance of the corresponding theoretical results."
"The paper shows that a form of Fictitious Self-Play converges to the Nash equilibria in Markov games. Understanding the theoretical properties of Fictitious Self-Play is important, however the paper in its current form is not ready for publication. The paper needs a more thorough discussion on related works, the assumptions made, and as pointed out by Reviewer3, the convergence argument needs to be expanded and explained in more detail. Further, I encourage authors to add experiments and compare their algorithm with other methods. ","The paper proposes a novel approach to neural network training, leveraging recent advancements in optimization techniques. Reviewers found the experimental results compelling, demonstrating significant improvements over existing methods. Overall, the paper received a positive recommendation with minor revisions. The paper needs a more thorough discussion on related works, the assumptions made, and the argument needs to be expanded and explained in more detail."
"This paper proposes a relatively complicated method for source-free unsupervised domain adaptation, which integrates several techniques into a divide and contrast framework. The idea of dividing the target data into source-like subset and target-specific subset and employing global alignment and feature consistency for each subset is novel when the source data is inaccessible. The contrastive learning and memory-based MMD are novel in the context of source-free domain adaptation and introduce theoretical benefits in terms of the expansion theory and domain alignment theory, respectively. Reviewers were on the positive side while holding some concerns on the marginal improvement over the SoTA methods, which were addressed in the author rebuttal. AC generally agreed that the paper has introduced a novel and solid contribution to the field, with a nice connection between algorithmic methods and theoretical insights, and  recommended the paper for acceptance. Authors are suggested to incorporate all rebuttal material in the revision and if possible, to work out a recipe for easing the adoption of their relatively complicated framework that comes with many modules and loss terms.","This paper proposes a novel approach to neural network training, leveraging recent advancements in optimization techniques. Reviewers found the experimental results compelling, demonstrating significant improvements over existing methods. Overall, the paper received a positive recommendation with minor revisions. The reviewers were on the positive side while holding some concerns about the marginal improvement over the SoTA methods, which were addressed in the author rebuttal."
"This paper explores the use of partial rejection control (PRC) for improved SMC-based variational bounds. While an unbiased SMC variant with PRC has been previously introduced by Kudlicka et al. (2020), this work introduces innovations that can help apply such ideas to variational inference. These bounds result in improvements in empirical performance. 

This paper was heavily discussed, with significant engagement by both the authors and the reviewers. Most reviewers recommended acceptance of this paper, with one reviewer (R4) recommending against acceptance. R4's central concerns regard the novelty of the proposed approach and its positioning relative to the existing SMC literature. The authors argued vigorously in the comments that this paper should be judged as a contribution to the VI literature and not the SMC literature.  Unfortunately, I will recommend that this paper is rejected. It is my opinion that R4's concerns were not fully addressed.

On the one hand, I agree with the authors that there is significant value to be had in exploring variants of SMC for VI. Indeed, some prior art, like FIVO and IWAE, contributed little to the Monte Carlo literature. I believe that these were good contributions.

On the other hand, I am concerned that the current draft does not clearly circumscribe its contributions. I read the sections that disuss the works of Schmon et al. (2019) and Kudlicka et al. (2020), and the writing did not leave me with a clear enough sense of the differences. I also read the abstract and introduction of the paper. The introduction of the paper positions this work clearly within the VI literature, but does not clearly discuss prior SMC art, e.g., it does not cite Kudlicka et al. (2020). Despite citing rejection control for SMC, the writing of the abstract and introduction left me with the impression that this work was the first to introduce *unbiased, partial* rejection control for SMC. I believe that impressions matter and that the machine learning community should be generous to adjacent communities when assigning credit.

I realize that my decision is a matter of taste. I also want to say that I am confident that the authors have a clear sense of where their contribution sits, and I suspect that it is a valuable contribution. However, I cannot recommend the draft in its current form. If this is a contribution to the VI literature, as the authors argue, then the authors should not hesitate to give full credit to prior SMC art. My reading of the current draft still leaves me confused about which aspects of the SMC estimator are actual contributions.","This paper proposes a novel approach to neural network training, leveraging recent advancements in optimization techniques. Reviewers found the experimental results compelling, but some concerns about generalization were noted. Overall, the paper received a positive recommendation with minor revisions. However, the reviewers argued strongly that this paper should be considered as a contribution to the VI literature and not the SMC literature. I agree with the authors that the current draft does not clearly circumscribe its contributions."
"This paper addresses a meta-learning method which involves bilevel optimization. It is claimed that two limitations (myopia of MG and restricted consideration of geometry of search space) that most of existing methods have can be resolved by the MBG with a properly chosen pseudo-metric. The algorithm first bootstraps a target from the meta- learner, then optimizes the meta-learner by minimizing the distance to that target under a chosen pseudo-metric. The authors also establish conditions that guarantee performance improvements and show that metric can be sued to control meta-optimization. All the reviewers agree that the idea is interesting and experiments well support it. Authors did a good job in the rebuttal phase, resolving most of concerns raised by reviewers, leading that two of reviewers raised their score. While the current theoretical results are limited to a simple case where L=1$, the method is attractive for meta-learning community. All reviewers agree to champion this paper. Congratulations on a nice work.","This paper proposes a novel approach to neural network training, leveraging recent advancements in optimization techniques. Reviewers found the experimental results compelling, demonstrating significant improvements over existing methods. Overall, the paper received a positive recommendation with minor revisions. All reviewers agree that the paper is interesting and experiments well support it."
"Dear Authors,
thank you very much for your submission. We are happy to inform you that
we have decided to accept it and we look forward to your talk in the workshop.
Please, go over the feedback in the reviews and correct or update your papers
in time for the camera ready date (May 24). In particular, please address the
comments raised by both reviewers regarding clarity, discussion of related work,
and additional experimental results, by making use of the additional space (9 pages) 
allowed by HSDIP.
Best regards
HSDIP organizers","Your task is to generate concise summaries for the metareviews of various papers in the field of [insert specific field, e.g., machine learning]. Ensure that the summary is concise, informative, and accurately represents the content of the paper. Your summary should be between 2 to 4 sentences long. Reviewers found the experimental results compelling, demonstrating significant improvements over existing methods. However, some concerns were raised regarding the generalization of the approach to different datasets. Overall, the paper received a positive recommendation with minor revisions."
"This work presents a novel environment-free invariant learning method that uses an auxiliary network to learn environment-specific features, from which environment inferences can be derived. The method is composed of two jointly learned models, that take care of the environment identification, the learning of the invariant representations, and the label predictions, produced by a multi-headed neural network. The proposed model is compared to different alternative models from the literature of the field, in different challenging benchmarks, and the results show that it closely achieves the best possible invariant learning performance.

After some initial discussions, all reviewers agreed that this work is ready for publication, as the work addresses an important problem, presents good empirical results, and will be of significant interest to the community. 
","This paper presents a novel neural network training approach that uses an auxiliary network to learn environment-specific features, from which environment inferences can be derived. The method is composed of two jointly learned models, that take care of the environment identification, the learning of the invariant representations, and the label predictions, produced by a multi-headed neural network. Reviewers found the experimental results compelling, demonstrating significant improvements over existing methods. Overall, the paper received a positive recommendation with minor revisions."
All the reviewers appreciate the value of the proposed benchmarks. The remaining concerns seem addressable. I recommend accepting the paper while asking the authors to incorporate the review feedback into the camera-ready paper.,"Your task is to generate concise summaries for the metareviews of various papers in the field of [insert specific field, e.g., machine learning]. Ensure that the summary is concise, informative, and accurately represents the content of the paper. Your summary should be between 2 to 4 sentences long. Focus on highlighting the main contributions, strengths, weaknesses, and overall recommendation as evaluated by the reviewers. Overall, the paper received a positive recommendation with minor revisions."
"I thank the authors for their submission and active participation in the discussions. This papers is borderline. On the positive side, reviewers emphasized this is a well written [ovqB,1zPe] and sound paper [BUDa] with good theoretical [td5N,ovqB,1zPe] and empirical [BUDa,td5N,ovqB] results. On the negative side, reviewers remarked clarity [KyZj,AVki], incremental with respect to Tasse et al (2020) [KyZj], relatively restricted Boolean task algebra [td5N], toyish nature of the environments considered [ovqB], and some missing details [1zPe]. During discussion, the sentiment seems to be somewhat lukewarm with none of the reviewers strongly favoring acceptance or rejection. It seems the main remaining concern is around the toyish nature of the environments used in this paper. I acknowledge that and I believe the authors could include experiments on more complex environments. However, I also give the authors credit for addressing most of the reviewer's concerns during rebuttal and for presenting a solid empirical and theoretical result that the research community can build upon in the future. I am therefore recommending acceptance of this paper and highly encourage the authors to further improve their paper based on the reviewer feedback.","This paper proposes a novel approach to neural network training, leveraging recent advancements in optimization techniques. Reviewers found the experimental results compelling, demonstrating significant improvements over existing methods. Overall, the paper received a positive recommendation with minor revisions."" Overall, reviewers emphasized that this is a well written [ovqB,1zPe] and sound paper [BUDa] with good theoretical [td5N,ovQB,1,1ZPe], relatively restricted Boolean task algebra [e.g.,"
"This paper explores the performance of Q-learning in the presence of either one-sided feedback or full feedback. Such feedbacks play an important role in improving the resulting regret bounds, which are (almost) not affected by the dimension of the state and action space. The motivation of such feedback settings stems from problems like inventory control. However, the assumptions underlying the theory herein are often quite strong, which might limit the applicability of the theory. The dependency on the length per episode H can also be improved.   ","This paper proposes a novel approach to neural network training, leveraging recent advancements in optimization techniques. Reviewers found the experimental results compelling, demonstrating significant improvements over existing methods. However, some concerns were raised about generalization of the approach to different datasets. Overall, the paper received a positive recommendation with minor revisions."
"This work provides evaluations on serveral backdoor attacks and defenses on NLP data. The evaluation can be further improved by discussing related defenses, maintaining high quality and clear documentation, and discussing the stealthiness of the attacks.","This paper proposes a novel approach to neural network training, leveraging recent advancements in optimization techniques. Reviewers found the experimental results compelling, demonstrating significant improvements over existing methods. Overall, the paper received a positive recommendation with minor revisions."
"This paper studies using low-degree polynomials for analyzing statistical/computational gaps for high-dimensional inference problems and identify average-case settings that exhibit this gap.  This is a nice paper and above the bar, though it perhaps appeal to only a theoretical audience.","This paper proposes a novel approach to neural network training, leveraging recent advancements in optimization techniques. Reviewers found the experimental results compelling, demonstrating significant improvements over existing methods. Overall, the paper received a positive recommendation with minor revisions."
"The reviewers highly appreciated the replies and the additional experiments. We also had a private discussion on the paper. To summarize: the replies alleviated quite a few concerns, however the consensus was that the paper still does not meet the bar for a highly competitive conference like ICLR.

The idea of combining MPC (on a 'wrong' model)  with a learned cost function is very interesting and a promising direction. On the downside the reviewers are still not entirely convinced about the contribution and believe that the paper requires a significant re-write to incorporate the discussed points as well as an additional round of reviews.","The paper proposes a novel approach to neural network training, leveraging recent advancements in optimization techniques. Reviewers found the experimental results compelling, demonstrating significant improvements over existing methods. Overall, the paper received a positive recommendation with minor revisions. On the downside the reviewers are still not entirely convinced about the contribution and believe that the paper requires a significant re-write to incorporate the discussed points as well as an additional round of reviews."
"The paper surveys existing differentially private data synthesis
methods, and introduces an algorithm that learns both a generator and
a classifier in a differentially private mode.

The problem is highly timely and important. Results are promising.

Main remaining concerns after discussion between the reviewers and the
authors are:

- reason why the proposed scheme can give better classification
accuracy, should be clarified more

- unclarity on conclusions that can be drawn from the experiments. The
revised version has improved on this somewhat.

One explanation for the problems was suggested to be that the paper
tries, at the same time, to both present a new method and be a
survey. Is hard to do in a short paper, and as a result, the paper
lacks focus. At the very least, more work is needed.

The authors are encouraged to continue their work on this
important problem, and the review comments hopefully help in that.
","The paper introduces a novel approach to neural network training, leveraging recent advancements in optimization techniques. Reviewers found the experimental results compelling, demonstrating significant improvements over existing methods. Overall, the paper received a positive recommendation with minor revisions. The reviewers are encouraged to continue their work on this important problem, and the review comments hopefully help in that."
"This paper has been reviewed by four experts. Their independent evaluations were consistent, all recommended rejection. I agree with that assessment as this paper is not ready for publication at ICLR in its current form. The reviewers have provided the authors with ample constructive feedback and the authors have been encouraged to consider this feedback if they choose to continue the work on this topic.","Your task is to generate concise summaries for the metareviews of various papers in the field of [insert specific field, e.g., machine learning]. Ensure that the summary is concise, informative, and accurately represents the content of the paper. Your summary should be between 2 to 4 sentences long. Focus on highlighting the main contributions, strengths, weaknesses, and overall recommendation as evaluated by the reviewers. Overall, the paper received a positive recommendation with minor revisions."
